IP 10.0.2.15.22 > 10.0.2.2.61788: Flags [P.], seq 324161116:324161276, ack 332084062, win 65136, length 160
IP 10.0.2.2.61788 > 10.0.2.15.22: Flags [.], ack 324159836, win 65535, length 0
IP 10.0.2.2.61788 > 10.0.2.15.22: Flags [.], ack 324159996, win 65535, length 0
IP 10.0.2.2.61788 > 10.0.2.15.22: Flags [.], ack 324160156, win 65535, length 0
IP 10.0.2.2.61788 > 10.0.2.15.22: Flags [.], ack 324160316, win 65535, length 0
IP 10.0.2.2.61788 > 10.0.2.15.22: Flags [.], ack 324160476, win 65535, length 0
IP 10.0.2.2.61788 > 10.0.2.15.22: Flags [.], ack 324160636, win 65535, length 0
IP 10.0.2.15.22 > 10.0.2.2.61788: Flags [P.], seq 324161276:324161932, ack 332084062, win 65136, length 656
IP 10.0.2.2.61788 > 10.0.2.15.22: Flags [.], ack 324161932, win 65535, length 0
IP 10.0.2.15.22 > 10.0.2.2.61788: Flags [P.], seq 324161932:324162172, ack 332084062, win 65136, length 240
IP 10.0.2.2.61788 > 10.0.2.15.22: Flags [.], ack 324162172, win 65535, length 0
IP 10.0.2.15.22 > 10.0.2.2.61788: Flags [P.], seq 324162172:324162412, ack 332084062, win 65136, length 240
IP 10.0.2.2.61788 > 10.0.2.15.22: Flags [.], ack 324162412, win 65535, length 0
IP 10.0.2.15.22 > 10.0.2.2.61788: Flags [P.], seq 324162412:324162652, ack 332084062, win 65136, length 240
IP 10.0.2.15.22 > 10.0.2.2.61788: Flags [P.], seq 324162652:324162812, ack 332084062, win 65136, length 160
IP 10.0.2.2.61788 > 10.0.2.15.22: Flags [.], ack 324162652, win 65535, length 0
IP 10.0.2.2.61788 > 10.0.2.15.22: Flags [.], ack 324162812, win 65535, length 0
IP 10.0.2.15.22 > 10.0.2.2.61788: Flags [P.], seq 324162812:324163148, ack 332084062, win 65136, length 336
IP 10.0.2.2.61788 > 10.0.2.15.22: Flags [.], ack 324163148, win 65535, length 0
IP 10.0.2.15.22 > 10.0.2.2.61788: Flags [P.], seq 324163148:324163388, ack 332084062, win 65136, length 240
IP 10.0.2.2.61788 > 10.0.2.15.22: Flags [.], ack 324163388, win 65535, length 0
IP 10.0.2.15.22 > 10.0.2.2.61788: Flags [P.], seq 324163388:324163628, ack 332084062, win 65136, length 240
IP 10.0.2.2.61788 > 10.0.2.15.22: Fl--2018-05-29 13:29:38--  http://10.0.2.15.22/
