tcpdump: verbose output suppressed, use -v or -vv for full protocol decode
listening on eth0, link-type EN10MB (Ethernet), capture size 262144 bytes
ARP, Request who-has 198.13.0.14 tell 198.13.0.15, length 28
ARP, Reply 198.13.0.14 is-at 02:42:c6:0d:00:0e, length 28
IP 198.13.0.15.20 > 198.13.0.14.6201: Flags [S], seq 12345, win 8192, length 0
IP 198.13.0.14.6201 > 198.13.0.15.20: Flags [S.], seq 2094637955, ack 12346, win 29200, options [mss 1460], length 0
IP 198.13.0.15.20 > 198.13.0.14.6201: Flags [.], ack 2094637956, win 8192, length 0
IP 198.13.0.15.20 > 198.13.0.14.6201: Flags [P.EW], seq 12346:12347, ack 2094637956, win 8192, length 1
IP 198.13.0.14.6201 > 198.13.0.15.20: Flags [.], ack 12347, win 29200, length 0
IP 198.13.0.14.6201 > 198.13.0.15.20: Flags [P.], seq 2094637956:2094637957, ack 12347, win 29200, length 1
IP 198.13.0.14.6201 > 198.13.0.15.20: Flags [P.], seq 2094637956:2094637957, ack 12347, win 29200, length 1
IP 198.13.0.14.6201 > 198.13.0.15.20: Flags [P.], seq 2094637956:2094637957, ack 12347, win 29200, length 1
IP 198.13.0.15.20 > 198.13.0.14.6201: Flags [P.EW], seq 12347:12348, ack 2094637957, win 8192, length 1
IP 198.13.0.14.6201 > 198.13.0.15.20: Flags [P.], seq 2094637957:2094637958, ack 12348, win 29200, length 1
IP 198.13.0.14.6201 > 198.13.0.15.20: Flags [P.], seq 2094637957:2094637958, ack 12348, win 29200, length 1
IP 198.13.0.14.6201 > 198.13.0.15.20: Flags [P.], seq 2094637957:2094637958, ack 12348, win 29200, length 1
IP 198.13.0.15.20 > 198.13.0.14.6201: Flags [P.EW], seq 12348:12349, ack 2094637958, win 8192, length 1
IP 198.13.0.14.6201 > 198.13.0.15.20: Flags [P.], seq 2094637958:2094637959, ack 12349, win 29200, length 1
IP 198.13.0.14.6201 > 198.13.0.15.20: Flags [P.], seq 2094637958:2094637959, ack 12349, win 29200, length 1
IP 198.13.0.14.6201 > 198.13.0.15.20: Flags [P.], seq 2094637958:2094637959, ack 12349, win 29200, length 1
IP 198.13.0.15.20 > 198.13.0.14.6201: Flags [P.EW], seq 12349:12352, ack 2094637959, win 8192, length 3
IP 198.13.0.14.6201 > 198.13.0.15.20: Flags [P.], seq 2094637959:2094637960, ack 12352, win 29200, length 1
IP 198.13.0.15.20 > 198.13.0.14.6201: Flags [R], seq 12352, win 8192, length 0
